{
  "firstName": "John",
  "lastName": "Doe",
  "age": 21,
  "recruitment": "2020-01-01",
  "tags": [
    "new",
    "good"
  ],
  "address": {
    "street": "Baker St."
  },
  "deliveryAddresses": [
    {
      "street" : "Main St."
    },
    {
      "street" : "Second St."
    }
  ],
  "family": {
    "spouse": "Mary"
  }
}